{"$schema":"https://json-schema.org/draft/2020-12/schema","title":"Voxie Production Enablement Review Packet","type":"object","required":["packet_version","project_number","packet_id","title","domain","status","recorded_at_utc","local_date","timezone","authority","plan","gates","evidence","review","next_gate"],"properties":{"packet_version":{"type":"string","minLength":1},"project_number":{"type":"integer","minimum":1,"maximum":10},"packet_id":{"type":"string","pattern":"^[A-Z0-9_-]+$"},"title":{"type":"string","minLength":1},"domain":{"enum":["RAINBOW_BINARY","RAINBOW_CANDIDATES","RAINBOW_GENERATION","RSP_MEDIA","LUMI_CANON","NAVI_CANON","HUMPTY_CANON","PUBLISHING","BIG_SURPRISE_ALIGNMENT","BRANCH_PROTECTION"]},"status":{"enum":["READY_FOR_REVIEW","BLOCKED_EXTERNAL","READY_FOR_EXTERNAL_APPLY"]},"recorded_at_utc":{"type":"string","pattern":"^[0-9]{4}-[0-9]{2}-[0-9]{2}T[0-9]{2}:[0-9]{2}:[0-9]{2}Z$"},"local_date":{"type":"string","pattern":"^[0-9]{4}-[0-9]{2}-[0-9]{2}$"},"timezone":{"const":"America/Chicago"},"authority":{"type":"object","additionalProperties":false,"required":["source_paths","decisions_preserved","execution_authorized","merge_authorized","publication_authorized"],"properties":{"source_paths":{"type":"array","minItems":1,"uniqueItems":true,"items":{"type":"string","minLength":1}},"decisions_preserved":{"const":true},"execution_authorized":{"const":false},"merge_authorized":{"const":false},"publication_authorized":{"const":false}}},"plan":{"type":"object","additionalProperties":false,"required":["objective","steps","deliverables"],"properties":{"objective":{"type":"string","minLength":1},"steps":{"type":"array","minItems":1,"items":{"type":"string","minLength":1}},"deliverables":{"type":"array","minItems":1,"uniqueItems":true,"items":{"type":"string","minLength":1}}}},"gates":{"type":"object","additionalProperties":false,"required":["required_approvals","blockers","spend_permission_provided","spend_authorized","credits_spent","provider_execution_performed"],"properties":{"required_approvals":{"type":"array","uniqueItems":true,"items":{"type":"string","pattern":"^[A-Z0-9_]+$"}},"blockers":{"type":"array","uniqueItems":true,"items":{"type":"string","pattern":"^[A-Z0-9_]+$"}},"spend_permission_provided":{"const":true},"spend_authorized":{"const":false},"credits_spent":{"const":0},"provider_execution_performed":{"const":false}}},"evidence":{"type":"object","additionalProperties":false,"required":["drive_items","provider_items","findings"],"properties":{"drive_items":{"type":"array","items":{"$ref":"#/$defs/drive_item"}},"provider_items":{"type":"array","items":{"$ref":"#/$defs/provider_item"}},"findings":{"type":"array","minItems":1,"items":{"$ref":"#/$defs/finding"}}}},"review":{"type":"object","additionalProperties":false,"required":["result","reviewer_context","independent_review","process_complete"],"properties":{"result":{"enum":["PASS","PASS_WITH_EXTERNAL_BLOCKERS"]},"reviewer_context":{"const":"OWNER_CONTEXT"},"independent_review":{"enum":["NOT_CLAIMED","PENDING_EXTERNAL"]},"process_complete":{"const":true}}},"details":{"type":"object"},"next_gate":{"type":"string","minLength":1}},"$defs":{"drive_item":{"type":"object","additionalProperties":false,"required":["id","title","mime_type","url","role","state"],"properties":{"id":{"type":"string","minLength":1},"title":{"type":"string","minLength":1},"mime_type":{"type":"string","minLength":1},"url":{"type":"string","pattern":"^https://(drive\\.google\\.com|docs\\.google\\.com)/"},"role":{"type":"string","minLength":1},"state":{"type":"string","minLength":1},"bytes":{"type":"integer","minimum":0}}},"provider_item":{"type":"object","additionalProperties":false,"required":["provider","task_id","shot_ids","sha256","state"],"properties":{"provider":{"type":"string","minLength":1},"task_id":{"type":"string","minLength":1},"shot_ids":{"type":"array","minItems":1,"uniqueItems":true,"items":{"type":"string","pattern":"^S[0-9]{2}$"}},"sha256":{"type":"string","pattern":"^[a-f0-9]{64}$"},"state":{"type":"string","minLength":1}}},"finding":{"type":"object","additionalProperties":false,"required":["severity","rule_id","message","disposition"],"properties":{"severity":{"enum":["info","warning","error"]},"rule_id":{"type":"string","pattern":"^[A-Z0-9_]+$"},"message":{"type":"string","minLength":1},"disposition":{"type":"string","pattern":"^[A-Z0-9_]+$"}}}}}
