{"packet_version":"1.0","project_number":8,"packet_id":"VOS-ENABLEMENT-P08","title":"Completed-master publishing review matrix","domain":"PUBLISHING","status":"READY_FOR_REVIEW","recorded_at_utc":"2026-08-29T16:32:10Z","local_date":"2026-08-29","timezone":"America/Chicago","authority":{"source_paths":["manifests/distribution/big-surprise/release-readiness-v01.yaml","manifests/distribution/freeze-dance/release-readiness-v01.yaml","manifests/distribution/colorful-day/release-readiness-v01.yaml"],"decisions_preserved":true,"execution_authorized":false,"merge_authorized":false,"publication_authorized":false},"plan":{"objective":"Create one cross-production publishing review matrix without authorizing upload, scheduling, account writes, or publication.","steps":["Confirm each master and release-readiness record remains current.","Prepare platform metadata fields, thumbnail requirements, Made for Kids checks, accessibility decisions, vertical-derivative needs, and schedule fields.","Keep each project blocked until its own approvals are complete.","Record publication links only after explicit publication."],"deliverables":["Three-project release matrix","Metadata and thumbnail checklist","Accessibility and Made for Kids checklist","Schedule and explicit-publication gate"]},"gates":{"required_approvals":["PER_PROJECT_FINALIZATION","PER_PROJECT_METADATA_APPROVAL","PER_PROJECT_THUMBNAIL_APPROVAL","MADE_FOR_KIDS_APPROVAL","ACCESSIBILITY_APPROVAL","SCHEDULE_APPROVAL","EXPLICIT_PUBLICATION_APPROVAL"],"blockers":["PLATFORM_PACKAGES_INCOMPLETE","PUBLICATION_NOT_AUTHORIZED"],"spend_permission_provided":true,"spend_authorized":false,"credits_spent":0,"provider_execution_performed":false},"evidence":{"drive_items":[],"provider_items":[],"findings":[{"severity":"info","rule_id":"THREE_RELEASE_RECORDS_READY","message":"Big Surprise, Freeze Dance, and Colorful Day have current release-readiness control records.","disposition":"READY_FOR_PUBLISHING_REVIEW"},{"severity":"warning","rule_id":"PUBLICATION_SEPARATELY_GATED","message":"A locked master or approved distribution authority does not authorize going live.","disposition":"NO_ACCOUNT_WRITE"}]},"review":{"result":"PASS","reviewer_context":"OWNER_CONTEXT","independent_review":"NOT_CLAIMED","process_complete":true},"details":{"projects":[{"project_id":"VWF-BIG-SURPRISE","state":"REVIEW","special_gate":"USER_FINALIZATION_AND_PLATFORM_PACKAGE"},{"project_id":"VWF-FREEZE-DANCE","state":"REVIEW","special_gate":"AUDIO_PEAK_AND_ACCESSIBILITY_REVIEW"},{"project_id":"VWF-COLORFUL-DAY","state":"REVIEW","special_gate":"DISTRIBUTION_INVENTORY_AND_NO_CAPTION_ACCESSIBILITY_DECISION"}],"platforms":["youtube","tiktok","instagram"],"upload_authorized":false,"publish_authorized":false},"next_gate":"Route the matrix to 04 — Publishing & Social Media for per-project metadata, thumbnail, accessibility, schedule, and publication decisions."}
