{"packet_version":"1.0","project_number":7,"packet_id":"VOS-ENABLEMENT-P07","title":"Humpty branch-reconciliation review package","domain":"HUMPTY_CANON","status":"READY_FOR_REVIEW","recorded_at_utc":"2026-08-29T16:32:10Z","local_date":"2026-08-29","timezone":"America/Chicago","authority":{"source_paths":["manifests/characters/status-register-v01.yaml"],"decisions_preserved":true,"execution_authorized":false,"merge_authorized":false,"publication_authorized":false},"plan":{"objective":"Turn Humpty's patchwork and cream-blue historical branches into an explicit canon decision without silent promotion.","steps":["Review both branches as separate historical production evidence.","Compare shell shape, color blocking, face, hat or bow accessories, role, and episode history.","Choose global canon, production-specific variants, separate characters, or continued hold.","Define which branch, if any, may be used in future productions."],"deliverables":["Humpty two-branch comparison matrix","Five-option decision form","Future-use and migration rules"]},"gates":{"required_approvals":["HUMPTY_GLOBAL_CANON_DECISION","HUMPTY_ACCESSORY_POLICY_APPROVAL","HUMPTY_MIGRATION_APPROVAL"],"blockers":[],"spend_permission_provided":true,"spend_authorized":false,"credits_spent":0,"provider_execution_performed":false},"evidence":{"drive_items":[],"provider_items":[],"findings":[{"severity":"warning","rule_id":"HUMPTY_BRANCH_CONFLICT","message":"The rainbow-patchwork and cream-blue branches differ in identity-defining color and accessory language.","disposition":"EXPLICIT_DECISION_REQUIRED"},{"severity":"info","rule_id":"HUMPTY_HISTORY_PRESERVED","message":"Both branches remain historical production evidence and neither is promoted automatically.","disposition":"NO_OVERWRITE"}]},"review":{"result":"PASS","reviewer_context":"OWNER_CONTEXT","independent_review":"NOT_CLAIMED","process_complete":true},"details":{"branches":[{"branch_id":"HUMPTY_RAINBOW_PATCHWORK","description":"Rainbow patchwork egg character from the grocery-store branch.","state":"HISTORICAL_PRODUCTION_BRANCH"},{"branch_id":"HUMPTY_CREAM_BLUE","description":"Cream egg with blue bow and blue-yellow hat from the platform branch.","state":"HISTORICAL_PRODUCTION_BRANCH"}],"decision_options":["GLOBAL_CANON_PATCHWORK","GLOBAL_CANON_CREAM_BLUE","PRODUCTION_SPECIFIC_VARIANTS","SEPARATE_CHARACTERS","CONTINUE_HOLD"],"recommended_review_path":"PRESERVE_SEPARATELY_UNTIL_EXPLICIT_DECISION"},"next_gate":"Present both branches and decision options for explicit Character Canon approval."}
