{"packet_version":"1.0","project_number":3,"packet_id":"VOS-ENABLEMENT-P03","title":"Rainbow Colors fifteen-shot new-pixel generation gate","domain":"RAINBOW_GENERATION","status":"BLOCKED_EXTERNAL","recorded_at_utc":"2026-08-29T16:32:10Z","local_date":"2026-08-29","timezone":"America/Chicago","authority":{"source_paths":["manifests/productions/rainbow-colors/production-state-v04.yaml","config/providers.v1.yaml"],"decisions_preserved":true,"execution_authorized":false,"merge_authorized":false,"publication_authorized":false},"plan":{"objective":"Define the shot list, review sequence, and spend boundary for every Rainbow Colors shot that genuinely requires new pixels.","steps":["Verify the authenticated MagicLight live balance before quoting or authorizing any generation.","Use locked Voxie canon and shot-purpose constraints for each prompt.","Generate one preview per authorized shot; do not batch-promote.","Run hard QC and request explicit approval before any lock or motion derivative.","Record task IDs, output hashes, cost, pre/post balance, and rejection history."],"deliverables":["Fifteen-shot generation queue","Per-shot preview and QC gate","Provider cost and balance ledger"]},"gates":{"required_approvals":["MAGICLIGHT_LIVE_BALANCE_VERIFICATION","PER_SHOT_GENERATION_APPROVAL","PER_SHOT_PREVIEW_APPROVAL","PER_SHOT_LOCK_APPROVAL"],"blockers":["MAGICLIGHT_LIVE_BALANCE_UNVERIFIED","EXACT_CANON_REFERENCE_MUST_BE_AVAILABLE"],"spend_permission_provided":true,"spend_authorized":false,"credits_spent":0,"provider_execution_performed":false},"evidence":{"drive_items":[],"provider_items":[],"findings":[{"severity":"warning","rule_id":"MAGICLIGHT_BALANCE_UNVERIFIED","message":"No authenticated current MagicLight balance is available; general spend permission cannot authorize provider execution.","disposition":"SPEND_BLOCKED"},{"severity":"info","rule_id":"FIFTEEN_SHOTS_DEFINED","message":"The complete new-pixel set is fixed and excludes shots with existing or review-candidate sources.","disposition":"QUEUE_READY"}]},"review":{"result":"PASS_WITH_EXTERNAL_BLOCKERS","reviewer_context":"OWNER_CONTEXT","independent_review":"PENDING_EXTERNAL","process_complete":true},"details":{"shot_ids":["S06","S09","S10","S11","S12","S13","S14","S16","S17","S22","S23","S25","S26","S29","S36"],"shot_count":15,"historical_balance_evidence":[86395,86305],"historical_difference_credits":90,"quoted_route_credits":2300,"current_live_balance":"UNVERIFIED","max_authorized_credits":0},"next_gate":"Authenticate MagicLight, capture the live balance, and return a fresh per-shot quote before authorizing any preview."}
