{"packet_version":"1.0","project_number":6,"packet_id":"VOS-ENABLEMENT-P06","title":"Navi branch-reconciliation review package","domain":"NAVI_CANON","status":"READY_FOR_REVIEW","recorded_at_utc":"2026-08-29T16:32:10Z","local_date":"2026-08-29","timezone":"America/Chicago","authority":{"source_paths":["manifests/characters/status-register-v01.yaml"],"decisions_preserved":true,"execution_authorized":false,"merge_authorized":false,"publication_authorized":false},"plan":{"objective":"Turn Navi's two historical production branches into an explicit canon decision without silently overwriting either branch.","steps":["Review the robotic-fairy and organic leaf-fairy branches as separate evidence.","Compare face, body language, costume, wings, palette, role, and production history.","Choose global canon, production-specific variants, separate characters, or continued hold.","Record any rename and migration plan before permitting production use."],"deliverables":["Navi two-branch comparison matrix","Five-option decision form","Migration and non-substitution rules"]},"gates":{"required_approvals":["NAVI_GLOBAL_CANON_DECISION","NAVI_BRANCH_NAMING_APPROVAL","NAVI_MIGRATION_APPROVAL"],"blockers":[],"spend_permission_provided":true,"spend_authorized":false,"credits_spent":0,"provider_execution_performed":false},"evidence":{"drive_items":[],"provider_items":[],"findings":[{"severity":"warning","rule_id":"NAVI_BRANCH_CONFLICT","message":"Robotic-fairy and organic leaf-fairy branches are materially different and cannot be merged by inference.","disposition":"EXPLICIT_DECISION_REQUIRED"},{"severity":"info","rule_id":"NAVI_HISTORY_PRESERVED","message":"Both branches remain historical production evidence until a decision is approved.","disposition":"NO_OVERWRITE"}]},"review":{"result":"PASS","reviewer_context":"OWNER_CONTEXT","independent_review":"NOT_CLAIMED","process_complete":true},"details":{"branches":[{"branch_id":"NAVI_ROBOTIC_FAIRY","description":"White and dark robotic fairy with cyan face and four-wing language.","state":"HISTORICAL_PRODUCTION_BRANCH"},{"branch_id":"NAVI_ORGANIC_LEAF_FAIRY","description":"Teal-haired organic fairy with green leaf dress.","state":"HISTORICAL_PRODUCTION_BRANCH"}],"decision_options":["GLOBAL_CANON_ROBOTIC","GLOBAL_CANON_ORGANIC","PRODUCTION_SPECIFIC_VARIANTS","SEPARATE_CHARACTERS","CONTINUE_HOLD"],"recommended_review_path":"PRESERVE_SEPARATELY_UNTIL_EXPLICIT_DECISION"},"next_gate":"Present the two branches and five decision options for explicit Character Canon approval."}
