{"packet_version":"1.0","project_number":9,"packet_id":"VOS-ENABLEMENT-P09","title":"Big Surprise locked-audio alignment execution intake","domain":"BIG_SURPRISE_ALIGNMENT","status":"BLOCKED_EXTERNAL","recorded_at_utc":"2026-08-29T16:32:10Z","local_date":"2026-08-29","timezone":"America/Chicago","authority":{"source_paths":["workflows/big-surprise-multi-aligner-evaluation-v01.yaml","manifests/productions/big-surprise/beatmap-001.final.json","manifests/productions/big-surprise/shot-manifest-v01.yaml"],"decisions_preserved":true,"execution_authorized":false,"merge_authorized":false,"publication_authorized":false},"plan":{"objective":"Prepare the exact binary-intake and execution controls needed to run the review-only WhisperX and Yass comparison.","steps":["Mount the exact locked WAV and verify its SHA-256.","Review local WhisperX, vocal-separation, and Yass versions and licenses.","Run the adapters without changing lyric text or final BeatMap 001.","Normalize outputs and compute line-start, line-end, coverage, and exception metrics.","Return a review-only candidate; prohibit automatic promotion."],"deliverables":["Locked-WAV intake checklist","Adapter-version and license checklist","Comparison metric template","Review-only successor handoff"]},"gates":{"required_approvals":["LOCKED_WAV_HASH_APPROVAL","LOCAL_TOOL_VERSION_APPROVAL","ALIGNMENT_RESULT_REVIEW"],"blockers":["LOCKED_WAV_BINARY_NOT_MOUNTED"],"spend_permission_provided":true,"spend_authorized":false,"credits_spent":0,"provider_execution_performed":false},"evidence":{"drive_items":[],"provider_items":[],"findings":[{"severity":"warning","rule_id":"LOCKED_WAV_NOT_MOUNTED","message":"The final audio filename and fingerprint are known, but the exact WAV bytes are not mounted for execution.","disposition":"EXTERNAL_BINARY_REQUIRED"},{"severity":"info","rule_id":"BEATMAP_001_REMAINS_AUTHORITATIVE","message":"The experiment may produce review evidence only and cannot automatically replace final BeatMap 001.","disposition":"NO_AUTO_PROMOTION"}]},"review":{"result":"PASS_WITH_EXTERNAL_BLOCKERS","reviewer_context":"OWNER_CONTEXT","independent_review":"PENDING_EXTERNAL","process_complete":true},"details":{"audio_filename":"VWF_BIG_SURPRISE_AUDIO_MASTER_v01B_APPROVED_LOCKED.wav","audio_sha256":"600a2443ee20dafa0867cff7cddb0a74aeb430f91b755f5e7a918b50fa146c6b","duration_seconds":150.0,"historical_focus_window_seconds":[59.690002,81.11],"adapters":["AccurateScribe baseline","WhisperX forced alignment","Yass Reloaded vocal pitch-energy alignment"],"auto_promote":false},"next_gate":"Expose the exact locked WAV as downloadable bytes, verify its hash, and approve the local tool versions before execution."}
