{"packet_version":"1.0","project_number":1,"packet_id":"VOS-ENABLEMENT-P01","title":"Rainbow Colors exact-binary intake and rehash package","domain":"RAINBOW_BINARY","status":"BLOCKED_EXTERNAL","recorded_at_utc":"2026-08-29T16:32:10Z","local_date":"2026-08-29","timezone":"America/Chicago","authority":{"source_paths":["manifests/productions/rainbow-colors/production-state-v04.yaml"],"decisions_preserved":true,"execution_authorized":false,"merge_authorized":false,"publication_authorized":false},"plan":{"objective":"Define the complete exact-binary intake contract required before any Rainbow Colors render or assembly.","steps":["Receive the exact locked binaries through downloadable Drive or current-conversation attachments.","Compute SHA-256 on mounted bytes without modifying them.","Compare each fresh hash with the recorded fingerprint.","Reject any mismatch, thumbnail, screenshot, recreation, or parked substitute.","Record a stable execution locator only after hash match."],"deliverables":["Seven-item binary intake checklist","Fresh-rehash acceptance matrix","No-substitution rejection policy"]},"gates":{"required_approvals":["BINARY_INTAKE_REVIEW","FRESH_REHASH_APPROVAL"],"blockers":["EXACT_BINARY_BYTES_UNAVAILABLE","FRESH_SHA256_NOT_PERFORMED","STABLE_EXECUTION_LOCATORS_UNRESOLVED"],"spend_permission_provided":true,"spend_authorized":false,"credits_spent":0,"provider_execution_performed":false},"evidence":{"drive_items":[],"provider_items":[],"findings":[{"severity":"warning","rule_id":"BINARY_BYTES_UNAVAILABLE","message":"The exact active binaries are identified by authority but are not mounted in the execution runtime.","disposition":"BLOCKED_EXTERNAL_INPUT"},{"severity":"info","rule_id":"NO_SUBSTITUTION_POLICY","message":"Thumbnails, screenshots, recreated files, historical branches, and parked alternates are explicitly rejected.","disposition":"LOCKED"}]},"review":{"result":"PASS_WITH_EXTERNAL_BLOCKERS","reviewer_context":"OWNER_CONTEXT","independent_review":"PENDING_EXTERNAL","process_complete":true},"details":{"required_binaries":[{"role":"S01_LOCKED_STILL","filename":"VWF_RAINBOW_COLORS_S01_WONDER_LIGHT_OPENING_KF-A_v01_APPROVED_LOCKED.png","recorded_sha256":"cb2b72c91dbe630babd43229f55a868033203f78b2aed6411038a3717f914cba","known_locator":"file-library://file_0000000038f881f7a40de0921d6a73dc"},{"role":"S02_LOCKED_STILL","filename":"VWF_RAINBOW_COLORS_S02_SIX_COLOR_LIGHTS_KF-A_v01_APPROVED_LOCKED.png","recorded_sha256":"10a42a9a376772a01f78e7932a5eae7dc9d58306fe43a2283acb2bf26bc148ce","known_locator":"file-library://file_000000003bb081f786c6b3f196941e13"},{"role":"S03_LOCKED_STILL","filename":"VWF_RAINBOW_COLORS_S03_SIX_STEPPING_POOLS_KF-A_v01_APPROVED_LOCKED.png","recorded_sha256":"d29ee0c4cc2e4de5599cc64f12d982cf1ca778b5239ca805346ccb0a5651894f","known_locator":"file-library://file_000000007acc81f7896d61c56cfcb63f"},{"role":"LOCKED_AUDIO","filename":"VWF_RAINBOW_COLORS_AUDIO_MASTER_v01.1_APPROVED_LOCKED.wav","recorded_sha256":"6c5919525c0f8b465ed6625dfd9a1d59adfe38f0cd33147f3c4f453bc9650fb0","known_locator":"UNRESOLVED"},{"role":"S01_GLOW_REVEAL","filename":"VWF_RAINBOW_COLORS_S01_WONDER_LIGHT_GLOW_REVEAL_v01_APPROVED_LOCKED.mp4","recorded_sha256":"1464db416c0a6acee9baafce40e0a71e2c2d3060fda922ce631ad866628dbc55","known_locator":"UNRESOLVED"},{"role":"S02_MOTION_V04","filename":"VWF_RAINBOW_COLORS_S02_SIX_COLOR_LIGHTS_MOTION_v04_APPROVED_LOCKED.mp4","recorded_sha256":"6c05e761a8a139081851e465635cbc0904a9d9164400e9a60063db5b94473ca9","known_locator":"UNRESOLVED"},{"role":"S01_S02_TRANSITION","filename":"VWF_RAINBOW_COLORS_S01-S02_OPENING_TRANSITION_v01_APPROVED_LOCKED.mp4","recorded_sha256":"90d719f3e3611b57e52f18eafa1d10d3ab4a7c84e3f8704bbf39473909dfed69","known_locator":"UNRESOLVED"}],"required_count":7,"mounted_count":0,"fresh_rehash_count":0},"next_gate":"Attach or place all seven exact binaries in a byte-downloadable source, then run the fresh-hash matrix."}
