{"packet_version":"1.0","project_number":5,"packet_id":"VOS-ENABLEMENT-P05","title":"Lumi MagicLight preview-only creation package","domain":"LUMI_CANON","status":"BLOCKED_EXTERNAL","recorded_at_utc":"2026-08-29T16:32:10Z","local_date":"2026-08-29","timezone":"America/Chicago","authority":{"source_paths":["manifests/characters/status-register-v01.yaml","config/providers.v1.yaml"],"decisions_preserved":true,"execution_authorized":false,"merge_authorized":false,"publication_authorized":false},"plan":{"objective":"Prepare Lumi for one controlled character preview while preserving her approved identity and withholding production lock.","steps":["Authenticate MagicLight and verify the live balance before generation.","Load the approved Lumi identity prompt and prohibit Voxie substitution.","Generate one full-body neutral-background preview only.","Run character QC against identity, silhouette, face, medallion, cape/wings, and accessory constraints.","Do not apply, lock, or use in production without explicit approval."],"deliverables":["MagicLight operator prompt","Lumi hard-QC checklist","Preview-to-lock approval chain"]},"gates":{"required_approvals":["MAGICLIGHT_LIVE_BALANCE_VERIFICATION","LUMI_PREVIEW_SPEND_APPROVAL","LUMI_PREVIEW_QC_APPROVAL","LUMI_EXPLICIT_LOCK_APPROVAL"],"blockers":["MAGICLIGHT_SESSION_UNAVAILABLE","NO_APPROVED_PROVIDER_PREVIEW","NO_REUSABLE_ASSET_ID","NO_LOCKED_REFERENCE_PACKAGE"],"spend_permission_provided":true,"spend_authorized":false,"credits_spent":0,"provider_execution_performed":false},"evidence":{"drive_items":[],"provider_items":[],"findings":[{"severity":"info","rule_id":"LUMI_IDENTITY_PACKAGE_READY","message":"The approved identity can be expressed as a preview-only operator package without changing canon status.","disposition":"READY_AFTER_PROVIDER_ACCESS"},{"severity":"warning","rule_id":"LUMI_REMAINS_UNLOCKED","message":"A successful preview would still require explicit approval and lock before production use.","disposition":"PRODUCTION_BLOCKED"}]},"review":{"result":"PASS_WITH_EXTERNAL_BLOCKERS","reviewer_context":"OWNER_CONTEXT","independent_review":"PENDING_EXTERNAL","process_complete":true},"details":{"provider":"MagicLight","operation":"character_preview","output_count":1,"preview_only":true,"prompt":"Lumi the Wonder Scout is a separate child-friendly explorer character with an explorer suit, dark visor face, luminous blue expressions, a glowing star chest medallion, and translucent blue-light cape or wing forms. Preserve this exact identity. Full-body neutral-background preview, observant and optimistic expression, cautious gentle stance. No Voxie traits, no redesign, no new accessories, no costume change, no proportion change.","hard_constraints":["SEPARATE_FROM_VOXIE","DARK_VISOR_FACE","LUMINOUS_BLUE_EXPRESSION","STAR_CHEST_MEDALLION","TRANSLUCENT_BLUE_LIGHT_CAPE_OR_WINGS","NO_NEW_ACCESSORIES","NO_LOCK_BEFORE_APPROVAL"]},"next_gate":"Authenticate MagicLight, verify the live balance, and request a fresh one-preview quote before generation."}
