{"packet_version":"1.0","project_number":10,"packet_id":"VOS-ENABLEMENT-P10","title":"GitHub main-branch protection application package","domain":"BRANCH_PROTECTION","status":"READY_FOR_EXTERNAL_APPLY","recorded_at_utc":"2026-08-29T16:32:10Z","local_date":"2026-08-29","timezone":"America/Chicago","authority":{"source_paths":[".github/workflows/production-os-ci.yml",".github/pull_request_template.md","AGENTS.md"],"decisions_preserved":true,"execution_authorized":false,"merge_authorized":false,"publication_authorized":false},"plan":{"objective":"Convert the reviewed branch-protection recommendation into an exact repository-admin settings package.","steps":["Create or update the main-branch ruleset.","Require Production OS CI before merge.","Require one approving review and resolved conversations.","Dismiss stale approvals after new commits.","Block force pushes, branch deletion, and direct bypass except named emergency administrators.","Verify the resulting ruleset and branch-protection read endpoints."],"deliverables":["Admin settings specification","Application checklist","Post-application verification checklist","Rollback procedure"]},"gates":{"required_approvals":["REPOSITORY_ADMIN_APPROVAL","BRANCH_PROTECTION_APPLY_APPROVAL"],"blockers":["SAFE_BRANCH_RULESET_WRITE_UNAVAILABLE_IN_CURRENT_SESSION"],"spend_permission_provided":true,"spend_authorized":false,"credits_spent":0,"provider_execution_performed":false},"evidence":{"drive_items":[],"provider_items":[],"findings":[{"severity":"warning","rule_id":"MAIN_BRANCH_UNPROTECTED","message":"GitHub currently reports main as unprotected and required checks as procedurally enforced only.","disposition":"ADMIN_APPLY_REQUIRED"},{"severity":"info","rule_id":"POLICY_READY","message":"The exact required checks and review controls are fully specified for repository administration.","disposition":"READY_FOR_EXTERNAL_APPLY"}]},"review":{"result":"PASS_WITH_EXTERNAL_BLOCKERS","reviewer_context":"OWNER_CONTEXT","independent_review":"PENDING_EXTERNAL","process_complete":true},"details":{"branch":"main","current_protected":false,"required_status_checks":["Production OS CI"],"required_approving_reviews":1,"require_conversation_resolution":true,"dismiss_stale_reviews":true,"allow_force_pushes":false,"allow_deletions":false,"allow_direct_pushes":false},"next_gate":"Apply the ruleset through GitHub repository administration and verify the branch-protection state."}
