{
  "packet_version": "1.0",
  "project_number": 4,
  "packet_id": "VOS-ENABLEMENT-P04",
  "title": "Ready Set Play canonical media-authority draft",
  "domain": "RSP_MEDIA",
  "status": "READY_FOR_REVIEW",
  "recorded_at_utc": "2026-08-29T16:32:10Z",
  "local_date": "2026-08-29",
  "timezone": "America/Chicago",
  "authority": {
    "source_paths": [
      "manifests/characters/status-register-v01.yaml"
    ],
    "decisions_preserved": true,
    "execution_authorized": false,
    "merge_authorized": false,
    "publication_authorized": false
  },
  "plan": {
    "objective": "Create a review-ready media authority that connects the observed locked audio and endpoint stills to the approved timeline and asset index without inventing missing video.",
    "steps": [
      "Verify the Drive identities and locked states of the three endpoint stills and the audio master.",
      "Use the asset-index spreadsheet and approved 23-shot timeline as planning evidence.",
      "Keep the finish gate in review state.",
      "Record missing video binaries and checksum requirements as execution blockers."
    ],
    "deliverables": [
      "RSP media index draft",
      "Image/audio/document evidence map",
      "Missing-video and checksum blocker list"
    ]
  },
  "gates": {
    "required_approvals": [
      "RSP_MEDIA_INDEX_APPROVAL",
      "RSP_BINARY_CHECKSUM_APPROVAL",
      "RSP_VISUAL_COMPLETION_APPROVAL"
    ],
    "blockers": [
      "RSP_VIDEO_BINARIES_NOT_OBSERVED",
      "FRESH_MEDIA_HASHES_REQUIRED"
    ],
    "spend_permission_provided": true,
    "spend_authorized": false,
    "credits_spent": 0,
    "provider_execution_performed": false
  },
  "evidence": {
    "drive_items": [
      {
        "id": "1YzS2HLj43I_UjNM1iUJfx5PIoVEmyLFR",
        "title": "RSP_S16_TOP_Slide_Ready_LOCKED.png",
        "mime_type": "image/png",
        "url": "https://drive.google.com/file/d/1YzS2HLj43I_UjNM1iUJfx5PIoVEmyLFR/view?usp=drivesdk",
        "role": "locked endpoint still",
        "state": "LOCKED",
        "bytes": 2073953
      },
      {
        "id": "1Lqii-NrJrSH0nimV7U6xeRFFn_Ly0Uof",
        "title": "RSP_S15_START_Slide_Climb_LOCKED.png",
        "mime_type": "image/png",
        "url": "https://drive.google.com/file/d/1Lqii-NrJrSH0nimV7U6xeRFFn_Ly0Uof/view?usp=drivesdk",
        "role": "locked endpoint still",
        "state": "LOCKED",
        "bytes": 2119548
      },
      {
        "id": "1uohnYE4A7dWzDLsCMkDkRqiD58BG6M4H",
        "title": "RSP_S13_START_Tunnel_Entry_LOCKED.png",
        "mime_type": "image/png",
        "url": "https://drive.google.com/file/d/1uohnYE4A7dWzDLsCMkDkRqiD58BG6M4H/view?usp=drivesdk",
        "role": "locked endpoint still",
        "state": "LOCKED",
        "bytes": 2162478
      },
      {
        "id": "1zsKmWfW4rY9pv9l-etz2qbVJQmK7KNY0",
        "title": "Voxie_Ready_Set_Play_FINAL_MIX_v2_APPROVED_LOCKED.wav",
        "mime_type": "audio/wav",
        "url": "https://drive.google.com/file/d/1zsKmWfW4rY9pv9l-etz2qbVJQmK7KNY0/view?usp=drivesdk",
        "role": "locked audio master",
        "state": "LOCKED",
        "bytes": 50311674
      },
      {
        "id": "1KrY3rEurbKJPYhF11OLmjlnuTWAjxv6OcEmRr0yrPmA",
        "title": "Voxie_RSP_Master_Asset_Index",
        "mime_type": "application/vnd.google-apps.spreadsheet",
        "url": "https://docs.google.com/spreadsheets/d/1KrY3rEurbKJPYhF11OLmjlnuTWAjxv6OcEmRr0yrPmA/edit?usp=drivesdk",
        "role": "master asset index",
        "state": "ACTIVE"
      },
      {
        "id": "1kc-8hMUjO5zYfoo9IgNNpk7BV5He4ao8xEUho2P-xTU",
        "title": "Voxie_RSP_23_Shot_Timeline_v2_APPROVED",
        "mime_type": "application/vnd.google-apps.document",
        "url": "https://docs.google.com/document/d/1kc-8hMUjO5zYfoo9IgNNpk7BV5He4ao8xEUho2P-xTU/edit?usp=drivesdk",
        "role": "approved shot timeline",
        "state": "APPROVED"
      },
      {
        "id": "1N_X5MvzqvzZfevDhLjd1Kic3FlgEaD0tVYjz9v1heXk",
        "title": "RSP_Finish_Gate_2026-08-28_AUDIO_CLEARED_VISUAL_QC",
        "mime_type": "application/vnd.google-apps.document",
        "url": "https://docs.google.com/document/d/1N_X5MvzqvzZfevDhLjd1Kic3FlgEaD0tVYjz9v1heXk/edit?usp=drivesdk",
        "role": "finish gate",
        "state": "REVIEW"
      }
    ],
    "provider_items": [],
    "findings": [
      {
        "severity": "info",
        "rule_id": "RSP_LOCKED_MEDIA_OBSERVED",
        "message": "Three locked PNGs and one locked WAV are directly identified in the audited Drive workspace.",
        "disposition": "READY_FOR_INDEX_REVIEW"
      },
      {
        "severity": "warning",
        "rule_id": "RSP_VIDEO_BINARIES_MISSING",
        "message": "No video binaries were exposed in the audited RSP video folders; documents cannot substitute for them.",
        "disposition": "VIDEO_COMPLETION_BLOCKED"
      }
    ]
  },
  "review": {
    "result": "PASS_WITH_EXTERNAL_BLOCKERS",
    "reviewer_context": "OWNER_CONTEXT",
    "independent_review": "PENDING_EXTERNAL",
    "process_complete": true
  },
  "details": {
    "image_count": 3,
    "image_bytes": 6355979,
    "audio_count": 1,
    "audio_bytes": 50311674,
    "video_binary_count": 0,
    "document_count": 2,
    "spreadsheet_count": 1,
    "presentation_count": 0
  },
  "next_gate": "Approve the media index structure, then mount and hash every execution binary before visual assembly."
}
